{"schema_version":"collection-run.v1","lane":"DISCOVERY","run_id":"run_discovery_1e74e968e095440244da1b9d01171d3f","started_at":"2026-09-24T13:00:50Z","finished_at":"2026-09-24T13:12:00Z","contract_ref":"docs/COLLECTION_OS_V3.md@ab8b4337cd88a826a80530e8f9725aed74f6b30a","input_snapshot":{"canonical_main":{"docs/COLLECTION_OS_V3.md":"ab8b4337cd88a826a80530e8f9725aed74f6b30a","docs/COLLECTION_OPERATIONS_V1.md":"ce26ed7ea731315ae8c2beab5200aedcabf84465","docs/EVIDENCE_CAPTURE_AND_COVERAGE.md":"c9e2489d5e19b9d247efbaed214e70b6ab605f48","registry/collection/collection-os.v3.json":"081fcd8e35b60570f4f9b96af766bafd6fb6cfd0","registry/collection/typed-record-output.v1.json":"03f77326c7dff74b8e625f1cf4ced6e99a7e3fb9","schemas/foundation/typed-record-set.v1.schema.json":"110b0fd5592b60e7ce3fe51dae40ca43f4569870","schemas/foundation/collection-run.v1.schema.json":"2ff63489f19f1646ed4ebd000b25f2d9f5863c80","schemas/foundation/work-item.v1.schema.json":"1bd0df701472d3a9677ab479590bcdd6e5936990","schemas/foundation/work-claim.v1.schema.json":"d6a799e26bc1fc9f3f5043e877268f456eb6688b","schemas/foundation/evidence-capture-request.v1.schema.json":"ef5031adde2567851dd49f76cd3fd8f7f9250d47","registry/collection/r2-queue-mapper.v2.json":"c92a1e405153e529d98ea9998cf668b8071e4372"},"selected_work_id":"wrk_03255c61835c2380a6cef5155cbd8c6c","selection_reason":"No retry-due or explicit DISCOVERY follow-up remained after the 21:05 SUCCESS receipt; no 2026-09-24 Coverage Audit artifact existed, so normal exploration was selected.","prior_receipt":{"path":"staging/automation/receipts/discovery/2026/09/24/20260924T210500JST-discovery-run_discovery_58b120fef5f51477da64f1f96a45c52b-receipt.json","blob_sha":"c5888df7ce5e77efbf43cc72340b6ad6d8b73e15","final_status":"SUCCESS"},"claim":{"path":"staging/automation/work-claims/DISCOVERY/wrk_03255c61835c2380a6cef5155cbd8c6c/20260924T2200JST.json","blob_sha":"9638c6eb4a68a0f365198a29a6677d157586258b","lease_until":"2026-09-24T14:31:00Z"},"existing_subject_dedupe":"No repository code-search match for Gentherm + Modine Performance Technologies Reverse Morris Trust before semantic capture.","coverage_priority":"ABSENT"},"source_attempts":[{"fetch_key":"44f489325d3f4e7906794a85875254beafab59ea9230203d829e637a8e104475","source_id":"src.gentherm.rmt_sep17_2026","canonical_url":"https://ir.gentherm.com/news-releases/news-release-details/gentherm-and-modine-manufacturing-company-announce-additional","purpose":"Identify current announced RMT mechanics, estimated ownership/cash adjustments and closing timetable.","attempted_at":"2026-09-24T13:06:00Z","result":"SUCCESS_INDEXED_SOURCE_RESULT","failure_class":null,"retryable":false,"attempt_number":1,"next_retry_at":null,"terminal_reason":null,"evidence_ids":["ev_496927dd6cb137af3a31876b"],"volatility_class":"EVENT_DRIVEN"},{"fetch_key":"5c4f44d28efd2d52c212158c77e382403a910354cb8321a2d028132b0204efe3","source_id":"src.gentherm.rmt_sep17_2026","canonical_url":"https://ir.gentherm.com/news-releases/news-release-details/gentherm-and-modine-manufacturing-company-announce-additional","purpose":"Direct-open the selected official release.","attempted_at":"2026-09-24T13:07:00Z","result":"FAILED_DIRECT_OPEN_CACHE_MISS","failure_class":"PARSE_FAILED","retryable":false,"attempt_number":1,"next_retry_at":null,"terminal_reason":"Retrieval-layer direct-open cache miss. Fresh indexed source content already satisfied the DISCOVERY objective; do not blind-retry this request variant.","evidence_ids":["ev_496927dd6cb137af3a31876b"],"volatility_class":"EVENT_DRIVEN","checkpoint":{"fallback":"indexed source result retained"}},{"fetch_key":"818626bbc4bbc39d445a0b61883a8f45ceba1be5e5c4108638110aecd5460b80","source_id":"src.gentherm.rmt_jan29_2026","canonical_url":"https://ir.gentherm.com/news-releases/news-release-details/gentherm-and-modines-performance-technologies-business-combine","purpose":"Capture original announced transaction structure and economics without deep completion.","attempted_at":"2026-09-24T13:06:00Z","result":"SUCCESS_INDEXED_SOURCE_RESULT","failure_class":null,"retryable":false,"attempt_number":1,"next_retry_at":null,"terminal_reason":null,"evidence_ids":["ev_4df8822b7b46447101e046fa"],"volatility_class":"EVENT_DRIVEN"},{"fetch_key":"68062dc9254c2f333ba8b623f57f43e227e87a06ff4aa67d524b2075ac4b3f25","source_id":"src.sec.modine_8k_20260917","canonical_url":"https://www.sec.gov/Archives/edgar/data/67347/000110465926108614/tm2625565d1_8k.htm","purpose":"Retain the filing-side description of the September 17 RMT adjustment and detect unresolved contradictions.","attempted_at":"2026-09-24T13:06:00Z","result":"SUCCESS_INDEXED_SOURCE_RESULT","failure_class":null,"retryable":false,"attempt_number":1,"next_retry_at":null,"terminal_reason":null,"evidence_ids":["ev_f863d2de3acfcb0df8d794e5"],"volatility_class":"EVENT_DRIVEN"},{"fetch_key":"204cebf9397fff7b8bc06548cf2064d125339534df611454596ec887d479d6f3","source_id":"src.sec.modine_8k_20260917","canonical_url":"https://www.sec.gov/Archives/edgar/data/67347/000110465926108614/tm2625565d1_8k.htm","purpose":"Direct-open the selected SEC filing.","attempted_at":"2026-09-24T13:07:00Z","result":"FAILED_DIRECT_OPEN_CACHE_MISS","failure_class":"PARSE_FAILED","retryable":false,"attempt_number":1,"next_retry_at":null,"terminal_reason":"Retrieval-layer direct-open cache miss. Fresh indexed filing content already satisfied the DISCOVERY objective; do not blind-retry this request variant.","evidence_ids":["ev_f863d2de3acfcb0df8d794e5"],"volatility_class":"EVENT_DRIVEN","checkpoint":{"fallback":"indexed source result retained"}}],"recorded_items":[{"record_type":"DISCOVERY_CASE","subject_ref":"case:gentherm-modine-performance-technologies-rmt:2026","name":"Gentherm × Modine Performance Technologies Reverse Morris Trust","evidence_ids":["ev_496927dd6cb137af3a31876b","ev_4df8822b7b46447101e046fa","ev_f863d2de3acfcb0df8d794e5"],"note":"Semantic authority for this run is the typed-record-set.v1 sidecar built from the same retrieval process; this recorded item is audit-only."}],"observations":[{"observation_type":"discovery.selection","payload":{"subject_ref":"case:gentherm-modine-performance-technologies-rmt:2026","reason":"New reusable portfolio-separation/M&A/capital-allocation structure with explicit cash, ownership and tax-sensitive mechanics."}},{"observation_type":"discovery.protocol_deviation","payload":{"code":"PRECLAIM_CANDIDATE_SCOUTING","impact":"Candidate-level web scouting began after priority/receipt/coverage inspection but before the deterministic 22:00 WorkItem and claim were persisted. Selected-source semantic retrieval and all writes occurred after claim ownership. Run is PARTIAL rather than SUCCESS."}}],"coverage_delta":{"new_subjects":1,"new_evidence":3,"reused_evidence":0,"follow_up_work_items":3,"dimensions_found":["transaction_structure","money_flow","ownership_allocation","closing_timetable"],"dimensions_deferred":["final_exchange_ratio","final_cash_distribution","final_dividend","SpinCo_financing_terms","full_tax_and_separation_mechanics"]},"unknowns":["Final exchange ratio and final number of Gentherm shares to be issued at closing.","Final SpinCo cash distribution and final aggregate/per-share Gentherm special dividend.","SpinCo financing amount, lenders, pricing and security terms.","Whether the announced October 1 distribution/merger and October 7 dividend will complete exactly as announced."],"conflicts":[{"conflict_type":"special_dividend_record_date","evidence_ids":["ev_496927dd6cb137af3a31876b","ev_f863d2de3acfcb0df8d794e5"],"values":[{"source":"Gentherm Sep. 17 press release","value":"2026-09-28"},{"source":"indexed SEC 8-K text","value":"2026-09-29"}],"resolution":"UNRESOLVED_ROUTE_VERIFY_RECONCILE"}],"audit":{"agent":{"name":"ChatGPT Web Collection","model":null,"version":"collection-operations.v1+discovery.v1"},"external_search_performed":true,"deep_dive_performed":false,"independent_verification_performed":false,"r2_conversion_performed":false,"source_reuse_checked":true,"protected_originals_modified":false,"protocol_deviations":[{"code":"PRECLAIM_CANDIDATE_SCOUTING","detail":"Broad candidate scouting occurred before the deterministic 22:00 WorkItem and claim were persisted. Inventory, prior receipt and coverage state had already been inspected; selected-source semantic retrieval and subsequent writes occurred only after claim ownership.","status_effect":"PARTIAL"}]},"checkpoint":{"selected_subject_ref":"case:gentherm-modine-performance-technologies-rmt:2026","evidence_capture_request_ids":["req_e95eeaf465168a514112472bef33a1f9","req_d8e2bf49acd7c7d501f63369e9549762","req_7b590e001be9f2a8aca9cedc5851ddd4"],"emitted_work_ids":["wrk_164ab2f31b7e521045bece2e203bc2b5","wrk_ff389e014333a3a4bd0237be90044bb8","wrk_101c9f150a58e1dc2a875f4a2a30bf27"],"next_action":"Do not retry this PARTIAL solely because of the protocol deviation while claim is active. After lease expiry, retry may reuse fresh Evidence if operational policy requires a clean SUCCESS receipt."},"final_status":"PARTIAL","consumed_work_ids":["wrk_03255c61835c2380a6cef5155cbd8c6c"],"emitted_work_items":[{"schema_version":"collection-work-item.v1","work_id":"wrk_164ab2f31b7e521045bece2e203bc2b5","work_fingerprint":"164ab2f31b7e521045bece2e203bc2b5dabd27c07187530030af97da6ef9e25d","recommended_lane":"BACKFILL","subject_ref":"case:gentherm-modine-performance-technologies-rmt:2026","objective_type":"rmt_transaction_deepening","objective":{"fill":["SpinCo financing amount/terms","separation and distribution mechanics","final tax-opinion/ruling conditions","pro forma leverage and synergy economics","final exchange-ratio adjustment formula and distribution bridge"],"scope_limit":"known Gentherm-Modine Performance Technologies Reverse Morris Trust case only"},"rule_version":"collection-operations.v1+discovery-followup.v1","input_watermark":"discovery:run_discovery_1e74e968e095440244da1b9d01171d3f|subject:case:gentherm-modine-performance-technologies-rmt:202